{"summary":"ADRO rose with coal prices after China lifted imports.","drivers":[{"claim":"Coal benchmark rallied","evidence":"Newcastle coal rose 6% this week; ADRO rose 3.1% today.","linked":["ADRO","COAL","PTBA"],"sourceIds":["s1"]}],"connections":[{"from":"COAL","to":["ADRO","PTBA","ITMG"],"text":"Coal benchmark +6% this week lifts coal miners."}],"catalysts":[{"date":"2026-10-30","event":"ADRO Q3 results"}],"risks":["China import curbs return"],"sentiment":0.4,"confidence":"med","whatWouldChangeThisView":"A reversal in coal prices.","sources":[{"id":"s1","title":"Coal prices climb on China demand","url":"https://www.example.com/coal","publisher":"Kontan","publishedAt":"2026-10-21"}]}
